full_name,eai_url,link,pdf_link,publication_date,data_source,publication,title,eai_match,affiliation,type,citations
Tina Eliassi-Rad,https://ai.northeastern.edu/ai-our-people/tina-eliassi-rad/,https://dl.acm.org/doi/10.1145/2695664.2695860,,2015-04-01 00:00:00,ACM,SAC '15: Proceedings of the 30th Annual ACM Symposium on Applied Computing,EP-MEANS: an efficient nonparametric clustering of empirical probability distributions,False,,,0
Tina Eliassi-Rad,https://ai.northeastern.edu/ai-our-people/tina-eliassi-rad/,https://dl.acm.org/doi/10.5555/3192424.3192464,,2016-08-01 00:00:00,ACM,ASONAM '16: Proceedings of the 2016 IEEE/ACM International Conference on Advances in Social Networks Analysis and Mining,Nimblecore: a space-efficient external memory algorithm for estimating core numbers,False,,,0
Tina Eliassi-Rad,https://ai.northeastern.edu/ai-our-people/tina-eliassi-rad/,https://dl.acm.org/doi/10.1145/1458082.1458184,,2008-10-01 00:00:00,ACM,CIKM '08: Proceedings of the 17th ACM conference on Information and knowledge management,Fast mining of complex time-stamped events,False,,,0
Tina Eliassi-Rad,https://ai.northeastern.edu/ai-our-people/tina-eliassi-rad/,https://dl.acm.org/doi/10.1145/2487575.2487620,,2013-08-01 00:00:00,ACM,KDD '13: Proceedings of the 19th ACM SIGKDD international conference on Knowledge discovery and data mining,"Guided learning for role discovery (GLRD): framework, algorithms, and applications",False,,,0
Tina Eliassi-Rad,https://ai.northeastern.edu/ai-our-people/tina-eliassi-rad/,https://dl.acm.org/doi/10.1145/1401890.1401925,,2008-08-01 00:00:00,ACM,KDD '08: Proceedings of the 14th ACM SIGKDD international conference on Knowledge discovery and data mining,Using ghost edges for classification in sparsely labeled networks,False,,,0
Tina Eliassi-Rad,https://ai.northeastern.edu/ai-our-people/tina-eliassi-rad/,https://dl.acm.org/doi/10.1145/2792838.2800193,,2015-09-01 00:00:00,ACM,RecSys '15: Proceedings of the 9th ACM Conference on Recommender Systems,A Probabilistic Model for Using Social Networks in Personalized Item Recommendation,False,,,0
Tina Eliassi-Rad,https://ai.northeastern.edu/ai-our-people/tina-eliassi-rad/,https://dl.acm.org/doi/10.1145/1281192.1281271,,2007-08-01 00:00:00,ACM,KDD '07: Proceedings of the 13th ACM SIGKDD international conference on Knowledge discovery and data mining,Fast best-effort pattern matching in large attributed graphs,False,,,0
Tina Eliassi-Rad,https://ai.northeastern.edu/ai-our-people/tina-eliassi-rad/,https://dl.acm.org/doi/10.1007/s10618-008-0112-3,,2008-08-01 00:00:00,ACM,Data Mining and Knowledge Discovery (DMKD),Two heads better than one: pattern discovery in time-evolving multi-aspect data,False,,,0
Tina Eliassi-Rad,https://ai.northeastern.edu/ai-our-people/tina-eliassi-rad/,https://dl.acm.org/doi/10.1145/3514094.3534155,,2022-07-01 00:00:00,ACM,"AIES '22: Proceedings of the 2022 AAAI/ACM Conference on AI, Ethics, and Society",Examining Responsibility and Deliberation in AI Impact Statements and Ethics Reviews,False,,,0
Tina Eliassi-Rad,https://ai.northeastern.edu/ai-our-people/tina-eliassi-rad/,https://dl.acm.org/doi/10.1145/2536689.2536807,,2013-11-01 00:00:00,ACM,LBSN '13: Proceedings of the 6th ACM SIGSPATIAL International Workshop on Location-Based Social Networks,Hyperlocal: inferring location of IP addresses in real-time bid requests for mobile ads,False,,,0
Tina Eliassi-Rad,https://ai.northeastern.edu/ai-our-people/tina-eliassi-rad/,https://dl.acm.org/doi/10.1007/s10791-012-9190-3,,2012-06-01 00:00:00,ACM,Information Retrieval (INFRE),Gateway finder in large graphs: problem definitions and fast solutions,False,,,0
Tina Eliassi-Rad,https://ai.northeastern.edu/ai-our-people/tina-eliassi-rad/,https://dl.acm.org/doi/10.1145/2020408.2020512,,2011-08-01 00:00:00,ACM,KDD '11: Proceedings of the 17th ACM SIGKDD international conference on Knowledge discovery and data mining,It's who you know: graph mining using recursive structural features,False,,,0
Tina Eliassi-Rad,https://ai.northeastern.edu/ai-our-people/tina-eliassi-rad/,https://dl.acm.org/doi/10.1145/1921168.1921171,,2010-11-01 00:00:00,ACM,Co-NEXT '10: Proceedings of the 6th International COnference,Profiling-By-Association: a resilient traffic profiling solution for the internet backbone,False,,,0
Tina Eliassi-Rad,https://ai.northeastern.edu/ai-our-people/tina-eliassi-rad/,https://dl.acm.org/doi/10.1145/2396761.2396795,,2012-10-01 00:00:00,ACM,CIKM '12: Proceedings of the 21st ACM international conference on Information and knowledge management,"Gelling, and melting, large graphs by edge manipulation",False,,,0
Tina Eliassi-Rad,https://ai.northeastern.edu/ai-our-people/tina-eliassi-rad/,https://dl.acm.org/doi/10.1016/j.jpdc.2010.07.005,,2011-02-01 00:00:00,ACM,Journal of Parallel and Distributed Computing (JPDC),Massively parallel acceleration of a document-similarity classifier to detect web attacks,False,,,0
Tina Eliassi-Rad,https://ai.northeastern.edu/ai-our-people/tina-eliassi-rad/,https://dl.acm.org/doi/10.1145/1835804.1835828,,2010-07-01 00:00:00,ACM,KDD '10: Proceedings of the 16th ACM SIGKDD international conference on Knowledge discovery and data mining,Metric forensics: a multi-level approach for mining volatile graphs,False,,,0
Tina Eliassi-Rad,https://ai.northeastern.edu/ai-our-people/tina-eliassi-rad/,https://dl.acm.org/doi/10.1145/2339530.2339723,,2012-08-01 00:00:00,ACM,KDD '12: Proceedings of the 18th ACM SIGKDD international conference on Knowledge discovery and data mining,RolX: structural role extraction & mining in large graphs,False,,,0
Tina Eliassi-Rad,https://ai.northeastern.edu/ai-our-people/tina-eliassi-rad/,https://dl.acm.org/doi/book/10.5555/934497,,2001-01-01 00:00:00,ACM,,Building intelligent agents that learn to retrieve and extract information,False,,,0
Tina Eliassi-Rad,https://ai.northeastern.edu/ai-our-people/tina-eliassi-rad/,https://dl.acm.org/doi/10.1287/mnsc.2016.2489,,2017-09-01 00:00:00,ACM,Management Science (MANS),GOTCHA! Network-Based Fraud Detection for Social Security Fraud,False,,,0
Tina Eliassi-Rad,https://ai.northeastern.edu/ai-our-people/tina-eliassi-rad/,https://dl.acm.org/doi/10.1016/j.dss.2015.04.013,,2015-07-01 00:00:00,ACM,Decision Support Systems (DSSY),APATE,False,,,0
Tina Eliassi-Rad,https://ai.northeastern.edu/ai-our-people/tina-eliassi-rad/,https://dl.acm.org/doi/10.1145/1540276.1540298,,2008-12-01 00:00:00,ACM,ACM SIGKDD Explorations Newsletter (SIGKDD),SNAKDD 2008 social network mining and analysis postworkshop report,False,,,0
Tina Eliassi-Rad,https://ai.northeastern.edu/ai-our-people/tina-eliassi-rad/,https://dl.acm.org/doi/10.5555/645530.658310,,2001-06-01 00:00:00,ACM,ICML '01: Proceedings of the Eighteenth International Conference on Machine Learning,A Theory-Refinement Approach to Information Extraction,False,,,0
Tina Eliassi-Rad,https://ai.northeastern.edu/ai-our-people/tina-eliassi-rad/,https://dl.acm.org/doi/10.5555/1964698.1964736,,2011-03-01 00:00:00,ACM,"SBP'11: Proceedings of the 4th international conference on Social computing, behavioral-cultural modeling and prediction",Ranking information in networks,False,,,0
Tina Eliassi-Rad,https://ai.northeastern.edu/ai-our-people/tina-eliassi-rad/,https://dl.acm.org/doi/10.5555/941713.941731,,2003-01-01 00:00:00,ACM,Intelligent exploration of the web,Intelligent Web agents that learn to retrieve and extract information,False,,,0
Tina Eliassi-Rad,https://ai.northeastern.edu/ai-our-people/tina-eliassi-rad/,https://dl.acm.org/doi/10.1145/3254762,,2014-04-01 00:00:00,ACM,WWW '14 Companion: Proceedings of the 23rd International Conference on World Wide Web,Session details: Big graph mining 2014 workshop,False,,,0
Tina Eliassi-Rad,https://ai.northeastern.edu/ai-our-people/tina-eliassi-rad/,https://dl.acm.org/doi/10.1023/A%3A1026255313882,,2003-11-01 00:00:00,ACM,User Modeling and User-Adapted Interaction (KLU-USER),Contents of Volume 13,False,,,0
Tina Eliassi-Rad,https://ai.northeastern.edu/ai-our-people/tina-eliassi-rad/,https://dl.acm.org/doi/10.1145/3261081,,2015-05-01 00:00:00,ACM,WWW '15 Companion: Proceedings of the 24th International Conference on World Wide Web,Session details: Tutorials,False,,,0
Tina Eliassi-Rad,https://ai.northeastern.edu/ai-our-people/tina-eliassi-rad/,https://dl.acm.org/doi/10.1109/ICDMW.2007.15,,2007-10-01 00:00:00,ACM,ICDMW '07: Proceedings of the Seventh IEEE International Conference on Data Mining Workshops,An Examination of Experimental Methodology for Classifiers of Relational Data,False,,,0
Tina Eliassi-Rad,https://ai.northeastern.edu/ai-our-people/tina-eliassi-rad/,https://dl.acm.org/doi/10.1007/s10618-020-00714-8,,2021-01-01 00:00:00,ACM,Data Mining and Knowledge Discovery (DMKD),Online summarization of dynamic graphs using subjective interestingness for sequential data,False,,,0
Tina Eliassi-Rad,https://ai.northeastern.edu/ai-our-people/tina-eliassi-rad/,https://dl.acm.org/doi/10.1145/3284751.3284753,,2018-10-01 00:00:00,ACM,AI Matters (SIGAI-AIMATTERS),2018 ACM SIGAI student essay contest on artificial intelligence technologies,False,,,0
Tina Eliassi-Rad,https://ai.northeastern.edu/ai-our-people/tina-eliassi-rad/,https://dl.acm.org/doi/10.1145/3299869.3323667,,2019-06-01 00:00:00,ACM,SIGMOD '19: Proceedings of the 2019 International Conference on Management of Data,GRADES-NDA 2019: Joint International Workshop on Graph Data Management Experiences & Systems and Network Data Analytics,False,,,0
Tina Eliassi-Rad,https://ai.northeastern.edu/ai-our-people/tina-eliassi-rad/,https://dl.acm.org/doi/10.1109/ICDM.2010.145,,2010-12-01 00:00:00,ACM,ICDM '10: Proceedings of the 2010 IEEE International Conference on Data Mining,Detecting Novel Discrepancies in Communication Networks,False,,,0
Tina Eliassi-Rad,https://ai.northeastern.edu/ai-our-people/tina-eliassi-rad/,https://dl.acm.org/doi/10.1145/3580305.3599224,,2023-08-01 00:00:00,ACM,KDD '23: Proceedings of the 29th ACM SIGKDD Conference on Knowledge Discovery and Data Mining,The 3rd Workshop on Graph Learning Benchmarks (GLB 2023),False,,,0
Tina Eliassi-Rad,https://ai.northeastern.edu/ai-our-people/tina-eliassi-rad/,https://dl.acm.org/doi/10.1007/s10791-012-9199-7,,2012-06-01 00:00:00,ACM,Information Retrieval (INFRE),Guest editorial: Special issue on information retrieval for social media,False,,,0
Tina Eliassi-Rad,https://ai.northeastern.edu/ai-our-people/tina-eliassi-rad/,https://dl.acm.org/doi/10.1109/TVCG.2006.107,,2006-11-01 00:00:00,ACM,IEEE Transactions on Visualization and Computer Graphics (ITVC),Visual Analysis of Large Heterogeneous Social Networks by Semantic and Structural Abstraction,False,,,0
Tina Eliassi-Rad,https://ai.northeastern.edu/ai-our-people/tina-eliassi-rad/,https://dl.acm.org/doi/10.1109/TKDE.2014.2345482,,2015-03-01 00:00:00,ACM,IEEE Transactions on Knowledge and Data Engineering (IEEECS_TKDE),Fast Best-Effort Search on Graphs with Multiple Attributes,False,,,0
Tina Eliassi-Rad,https://ai.northeastern.edu/ai-our-people/tina-eliassi-rad/,https://dl.acm.org/doi/10.1109/ICDM.2009.50,,2009-12-01 00:00:00,ACM,ICDM '09: Proceedings of the 2009 Ninth IEEE International Conference on Data Mining,Evaluating Statistical Tests for Within-Network Classifiers of Relational Data,False,,,0
Tina Eliassi-Rad,https://ai.northeastern.edu/ai-our-people/tina-eliassi-rad/,https://dl.acm.org/doi/10.5555/3455716.3455811,,2020-01-01 00:00:00,ACM,The Journal of Machine Learning Research (JMLR),Cornac: a comparative framework for multimodal recommender systems,False,,,0
Tina Eliassi-Rad,https://ai.northeastern.edu/ai-our-people/tina-eliassi-rad/,https://dl.acm.org/doi/10.5555/3192424.3192452,,2016-08-01 00:00:00,ACM,ASONAM '16: Proceedings of the 2016 IEEE/ACM International Conference on Advances in Social Networks Analysis and Mining,Maxreach: reducing network incompleteness through node probes,False,,,0
Tina Eliassi-Rad,https://ai.northeastern.edu/ai-our-people/tina-eliassi-rad/,https://dl.acm.org/doi/10.1145/2009916.2010084,,2011-07-01 00:00:00,ACM,SIGIR '11: Proceedings of the 34th international ACM SIGIR conference on Research and development in Information Retrieval,Exploiting endorsement information and social influence for item recommendation,False,,,0
Tina Eliassi-Rad,https://ai.northeastern.edu/ai-our-people/tina-eliassi-rad/,https://dl.acm.org/doi/10.5555/1833515.1833560,,2010-03-01 00:00:00,ACM,INFOCOM'10: Proceedings of the 29th conference on Information communications,Link homophily in the application layer and its usage in traffic classification,False,,,0
Tina Eliassi-Rad,https://ai.northeastern.edu/ai-our-people/tina-eliassi-rad/,https://dl.acm.org/doi/10.1145/3511808.3557505,,2022-10-01 00:00:00,ACM,CIKM '22: Proceedings of the 31st ACM International Conference on Information & Knowledge Management,"Mining of Real-world Hypergraphs: Patterns, Tools, and Generators",False,,,0
Tina Eliassi-Rad,https://ai.northeastern.edu/ai-our-people/tina-eliassi-rad/,https://dl.acm.org/doi/10.1145/1374780.1374795,,2008-03-01 00:00:00,ACM,ACM SIGMOD Record (SIGMOD),Report on the First International Workshop on Mining Graphs and Complex Structures (MGCS'07),False,,,0
Tina Eliassi-Rad,https://ai.northeastern.edu/ai-our-people/tina-eliassi-rad/,https://dl.acm.org/doi/10.5555/2034161.2034195,,2011-09-01 00:00:00,ACM,ECML PKDD'11: Proceedings of the 2011 European conference on Machine learning and knowledge discovery in databases - Volume Part III,Correcting bias in statistical tests for network classifier evaluation,False,,,0
Tina Eliassi-Rad,https://ai.northeastern.edu/ai-our-people/tina-eliassi-rad/,https://dl.acm.org/doi/10.1109/SSDM.2003.1214983,,2003-07-01 00:00:00,ACM,SSDBM '03: Proceedings of the 15th International Conference on Scientific and Statistical Database Management,The evolution of a hierarchical partitioning algorithm for large-scale scientific data: three steps of increasing complexity,False,,,0
Tina Eliassi-Rad,https://ai.northeastern.edu/ai-our-people/tina-eliassi-rad/,https://dl.acm.org/doi/10.1007/978-3-642-13672-6_43,,2010-06-01 00:00:00,ACM,PAKDD'10: Proceedings of the 14th Pacific-Asia conference on Advances in Knowledge Discovery and Data Mining - Volume Part II,BASSET: scalable gateway finder in large graphs,False,,,0
Tina Eliassi-Rad,https://ai.northeastern.edu/ai-our-people/tina-eliassi-rad/,https://dl.acm.org/doi/10.1007/978-3-642-23808-6_33,,2011-09-01 00:00:00,ACM,ECMLPKDD'11: Proceedings of the 2011th European Conference on Machine Learning and Knowledge Discovery in Databases - Volume Part III,Correcting bias in statistical tests for network classifier evaluation,False,,,0
Tina Eliassi-Rad,https://ai.northeastern.edu/ai-our-people/tina-eliassi-rad/,https://dl.acm.org/doi/10.5555/3120828.3120850,,2008-09-01 00:00:00,ACM,ECMLPKDD'08: Proceedings of the 2008th European Conference on Machine Learning and Knowledge Discovery in Databases - Volume Part I,Two heads better than one: pattern discovery in time-evolving multi-aspect data,False,,,0
Tina Eliassi-Rad,https://ai.northeastern.edu/ai-our-people/tina-eliassi-rad/,https://dl.acm.org/doi/10.1109/HICSS.2015.114,,2015-01-01 00:00:00,ACM,HICSS '15: Proceedings of the 2015 48th Hawaii International Conference on System Sciences,Guilt-by-Constellation: Fraud Detection by Suspicious Clique Memberships,False,,,0
Tina Eliassi-Rad,https://ai.northeastern.edu/ai-our-people/tina-eliassi-rad/,https://dl.acm.org/doi/10.1145/974121.974137,,2004-03-01 00:00:00,ACM,ACM SIGMOD Record (SIGMOD),Simulation data as data streams,False,,,0
Tina Eliassi-Rad,https://ai.northeastern.edu/ai-our-people/tina-eliassi-rad/,https://dl.acm.org/doi/10.1145/2808797.2810058,,2015-08-01 00:00:00,ACM,ASONAM '15: Proceedings of the 2015 IEEE/ACM International Conference on Advances in Social Networks Analysis and Mining 2015,AFRAID: Fraud Detection via Active Inference in Time-evolving Social Networks,False,,,0
Tina Eliassi-Rad,https://ai.northeastern.edu/ai-our-people/tina-eliassi-rad/,https://dl.acm.org/doi/10.1145/1345448.1345468,,2007-12-01 00:00:00,ACM,ACM SIGKDD Explorations Newsletter (SIGKDD),WebKDD/SNAKDD 2007: web mining and social network analysis post-workshop report,False,,,0
Tina Eliassi-Rad,https://ai.northeastern.edu/ai-our-people/tina-eliassi-rad/,https://dl.acm.org/doi/10.1007/978-3-030-86520-7_33,,2021-09-01 00:00:00,ACM,Machine Learning and Knowledge Discovery in Databases. Research Track,PATHATTACK: Attacking Shortest Paths in Complex Networks,False,,,0
Tina Eliassi-Rad,https://ai.northeastern.edu/ai-our-people/tina-eliassi-rad/,https://dl.acm.org/doi/10.1145/2783258.2783267,,2015-08-01 00:00:00,ACM,KDD '15: Proceedings of the 21th ACM SIGKDD International Conference on Knowledge Discovery and Data Mining,Panther: Fast Top-k Similarity Search on Large Networks,False,,,0
Tina Eliassi-Rad,https://ai.northeastern.edu/ai-our-people/tina-eliassi-rad/,https://dl.acm.org/doi/10.1145/3622941,,2023-11-01 00:00:00,ACM,ACM Transactions on Knowledge Discovery from Data (TKDD),Attacking Shortest Paths by Cutting Edges,False,,,0
Tina Eliassi-Rad,https://ai.northeastern.edu/ai-our-people/tina-eliassi-rad/,https://dl.acm.org/doi/10.1109/ICDMW.2008.99,,2008-12-01 00:00:00,ACM,ICDMW '08: Proceedings of the 2008 IEEE International Conference on Data Mining Workshops,GRAPHITE: A Visual Query System for Large Graphs,False,,,0
Tina Eliassi-Rad,https://ai.northeastern.edu/ai-our-people/tina-eliassi-rad/,https://dl.acm.org/doi/10.1145/956863.956872,,2003-11-01 00:00:00,ACM,CIKM '03: Proceedings of the twelfth international conference on Information and knowledge management,Multi-resolution modeling of large scale scientific simulation data,False,,,0
Tina Eliassi-Rad,https://ai.northeastern.edu/ai-our-people/tina-eliassi-rad/,https://dl.acm.org/doi/10.1109/ICDM.2010.54,,2010-12-01 00:00:00,ACM,ICDM '10: Proceedings of the 2010 IEEE International Conference on Data Mining,On the Vulnerability of Large Graphs,False,,,0
Tina Eliassi-Rad,https://ai.northeastern.edu/ai-our-people/tina-eliassi-rad/,https://dl.acm.org/doi/10.1145/3374857.3374862,,2019-12-01 00:00:00,ACM,ACM SIGACT News (SIGACT),Technical Report Column,False,,,0
Tina Eliassi-Rad,https://ai.northeastern.edu/ai-our-people/tina-eliassi-rad/,https://dl.acm.org/doi/10.1145/3086695,,2017-08-01 00:00:00,ACM,ACM Transactions on Information Systems (TOIS),Fast and Flexible Top-k Similarity Search on Large Networks,False,,,0
Tina Eliassi-Rad,https://ai.northeastern.edu/ai-our-people/tina-eliassi-rad/,https://dl.acm.org/doi/10.5555/978-3-031-17140-6_fm,,2022-09-01 00:00:00,ACM,Computer Security – ESORICS 2022,Front Matter,False,,,0
Tina Eliassi-Rad,https://ai.northeastern.edu/ai-our-people/tina-eliassi-rad/,https://dl.acm.org/doi/10.1007/11530084_19,,2005-07-01 00:00:00,ACM,DILS'05: Proceedings of the Second international conference on Data Integration in the Life Sciences,Performance-oriented privacy-preserving data integration,False,,,0
Tina Eliassi-Rad,https://ai.northeastern.edu/ai-our-people/tina-eliassi-rad/,https://dl.acm.org/doi/10.1109/TKDE.2015.2465378,,2016-01-01 00:00:00,ACM,IEEE Transactions on Knowledge and Data Engineering (IEEECS_TKDE),Node Immunization on Large Graphs: Theory and Algorithms,False,,,0
Tina Eliassi-Rad,https://ai.northeastern.edu/ai-our-people/tina-eliassi-rad/,https://dl.acm.org/doi/10.1007/978-3-031-17140-6_26,,2022-09-01 00:00:00,ACM,Computer Security – ESORICS 2022,Cyber Network Resilience Against Self-Propagating Malware Attacks,False,,,0
Tina Eliassi-Rad,https://ai.northeastern.edu/ai-our-people/tina-eliassi-rad/,https://dl.acm.org/doi/10.1145/3582437.3582465,,2023-04-01 00:00:00,ACM,FDG '23: Proceedings of the 18th International Conference on the Foundations of Digital Games,Sturgeon-GRAPH: Constrained Graph Generation from Examples,False,,,0
Tina Eliassi-Rad,https://ai.northeastern.edu/ai-our-people/tina-eliassi-rad/,https://dl.acm.org/doi/10.5555/3495724.3497150,,2020-12-01 00:00:00,ACM,NIPS'20: Proceedings of the 34th International Conference on Neural Information Processing Systems,SAC: accelerating and structuring self-attention via sparse adaptive connection,False,,,0
Tina Eliassi-Rad,https://ai.northeastern.edu/ai-our-people/tina-eliassi-rad/,https://dl.acm.org/doi/10.1145/3097983.3098002,,2017-08-01 00:00:00,ACM,KDD '17: Proceedings of the 23rd ACM SIGKDD International Conference on Knowledge Discovery and Data Mining,The Co-Evolution Model for Social Network Evolving and Opinion Migration,False,,,0
Tina Eliassi-Rad,https://ai.northeastern.edu/ai-our-people/tina-eliassi-rad/,https://dl.acm.org/doi/10.5555/978-3-030-86520-7_fm,,2021-09-01 00:00:00,ACM,Machine Learning and Knowledge Discovery in Databases. Research Track,Front Matter,False,,,0
Tina Eliassi-Rad,https://ai.northeastern.edu/ai-our-people/tina-eliassi-rad/,https://dl.acm.org/doi/10.5555/3625834.3626067,,2023-07-01 00:00:00,ACM,UAI '23: Proceedings of the Thirty-Ninth Conference on Uncertainty in Artificial Intelligence,Graph self-supervised learning via proximity divergence minimization,False,,,0
Tina Eliassi-Rad,https://ai.northeastern.edu/ai-our-people/tina-eliassi-rad/,https://dl.acm.org/doi/10.5555/3495724.3496806,,2020-12-01 00:00:00,ACM,NIPS'20: Proceedings of the 34th International Conference on Neural Information Processing Systems,Reward propagation using graph convolutional networks,False,,,0
Tina Eliassi-Rad,https://ai.northeastern.edu/ai-our-people/tina-eliassi-rad/,https://dl.acm.org/doi/10.1609/aimag.v29i3.2157,,2008-09-01 00:00:00,ACM,AI Magazine (AIMA),Collective Classification in Network Data,False,,,0
Tina Eliassi-Rad,https://ai.northeastern.edu/ai-our-people/tina-eliassi-rad/,https://dl.acm.org/doi/10.1145/3511808.3557428,,2022-10-01 00:00:00,ACM,CIKM '22: Proceedings of the 31st ACM International Conference on Information & Knowledge Management,Relational Self-Supervised Learning on Graphs,False,,,0
Tina Eliassi-Rad,https://ai.northeastern.edu/ai-our-people/tina-eliassi-rad/,https://dl.acm.org/doi/10.1145/3394486.3403069,,2020-08-01 00:00:00,ACM,KDD '20: Proceedings of the 26th ACM SIGKDD International Conference on Knowledge Discovery & Data Mining,Local Community Detection in Multiple Networks,False,,,0
Tina Eliassi-Rad,https://ai.northeastern.edu/ai-our-people/tina-eliassi-rad/,https://dl.acm.org/doi/10.1007/978-3-030-32430-8_22,,2019-10-01 00:00:00,ACM,Decision and Game Theory for Security,: An Adaptive Reinforcement Learning Strategy for the  Security Game,False,,,0
Tina Eliassi-Rad,https://ai.northeastern.edu/ai-our-people/tina-eliassi-rad/,https://dl.acm.org/doi/10.5555/1577069.1755879,,2009-12-01 00:00:00,ACM,The Journal of Machine Learning Research (JMLR),Cautious Collective Classification,False,,,0
Tina Eliassi-Rad,https://ai.northeastern.edu/ai-our-people/tina-eliassi-rad/,https://dl.acm.org/doi/10.1145/3248788,,2010-07-01 00:00:00,ACM,KDD '10: Proceedings of the 16th ACM SIGKDD international conference on Knowledge discovery and data mining,Session details: Research track 8: graph algorithms,False,,,0
Tina Eliassi-Rad,https://ai.northeastern.edu/ai-our-people/tina-eliassi-rad/,https://dl.acm.org/doi/10.1145/2433396.2433472,,2013-02-01 00:00:00,ACM,WSDM '13: Proceedings of the sixth ACM international conference on Web search and data mining,LaFT-tree: perceiving the expansion trace of one's circle of friends in online social networks,False,,,0
Tina Eliassi-Rad,https://ai.northeastern.edu/ai-our-people/tina-eliassi-rad/,https://dl.acm.org/doi/10.5555/2486788.2486800,,2013-05-01 00:00:00,ACM,ICSE '13: Proceedings of the 2013 International Conference on Software Engineering,Inferring likely mappings between APIs,False,,,0
Tina Eliassi-Rad,https://ai.northeastern.edu/ai-our-people/tina-eliassi-rad/,https://dl.acm.org/doi/10.1145/3461702.3462621,,2021-07-01 00:00:00,ACM,"AIES '21: Proceedings of the 2021 AAAI/ACM Conference on AI, Ethics, and Society",What's Fair about Individual Fairness?,False,,,0
Tina Eliassi-Rad,https://ai.northeastern.edu/ai-our-people/tina-eliassi-rad/,https://dl.acm.org/doi/10.1145/3577022,,2023-02-01 00:00:00,ACM,ACM Transactions on Knowledge Discovery from Data (TKDD),Hierarchical Dense Pattern Detection in Tensors,False,,,0
Tina Eliassi-Rad,https://ai.northeastern.edu/ai-our-people/tina-eliassi-rad/,https://dl.acm.org/doi/10.5555/3618408.3618735,,2023-07-01 00:00:00,ACM,ICML'23: Proceedings of the 40th International Conference on Machine Learning,Towards understanding and reducing graph structural noise for GNNs,False,,,0
Tina Eliassi-Rad,https://ai.northeastern.edu/ai-our-people/tina-eliassi-rad/,https://dl.acm.org/doi/10.5555/3455716.3455765,,2020-01-01 00:00:00,ACM,The Journal of Machine Learning Research (JMLR),Ensemble learning for relational data,False,,,0
Tina Eliassi-Rad,https://ai.northeastern.edu/ai-our-people/tina-eliassi-rad/,https://dl.acm.org/doi/10.1145/3588922,,2023-05-01 00:00:00,ACM,Proceedings of the ACM on Management of Data (PACMMOD),Efficient Resistance Distance Computation: The Power of Landmark-based Approaches,False,,,0
Tina Eliassi-Rad,https://ai.northeastern.edu/ai-our-people/tina-eliassi-rad/,https://dl.acm.org/doi/10.1007/s10618-020-00717-5,,2021-01-01 00:00:00,ACM,Data Mining and Knowledge Discovery (DMKD),The network-untangling problem: from interactions to activity timelines,False,,,0
Tina Eliassi-Rad,https://ai.northeastern.edu/ai-our-people/tina-eliassi-rad/,https://dl.acm.org/doi/book/10.5555/AAI28263625,,2020-01-01 00:00:00,ACM,,"Constructing, Comparing, and Reconstructing Networks",False,,,0
Tina Eliassi-Rad,https://ai.northeastern.edu/ai-our-people/tina-eliassi-rad/,https://dl.acm.org/doi/10.1137/19M1262632,,2021-01-01 00:00:00,ACM,Multiscale Modeling and Simulation (MMS),"Tunable Eigenvector-Based Centralities for Multiplex and Temporal
Networks",False,,,0
