full_name,eai_url,link,pdf_link,publication_date,data_source,publication,title,eai_match,affiliation,type,citations
David Smith,https://ai.northeastern.edu/ai-our-people/david-smith/,https://dl.acm.org/doi/10.1145/1871437.1871718,,2010-10-01 00:00:00,ACM,CIKM '10: Proceedings of the 19th ACM international conference on Information and knowledge management,Building a semantic representation for personal information,False,,,0
David Smith,https://ai.northeastern.edu/ai-our-people/david-smith/,https://dl.acm.org/doi/10.1145/2499178.2499189,,2013-09-01 00:00:00,ACM,ICTIR '13: Proceedings of the 2013 Conference on the Theory of Information Retrieval,Efficient Nearest-Neighbor Search in the Probability Simplex,False,,,0
David Smith,https://ai.northeastern.edu/ai-our-people/david-smith/,https://dl.acm.org/doi/10.1109/ICDAR.2013.183,,2013-08-01 00:00:00,ACM,ICDAR '13: Proceedings of the 2013 12th International Conference on Document Analysis and Recognition,Using a Probabilistic Syllable Model to Improve Scene Text Recognition,False,,,0
David Smith,https://ai.northeastern.edu/ai-our-people/david-smith/,https://dl.acm.org/doi/10.1145/2339055.2339060,,2012-09-01 00:00:00,ACM,ACM Inroads (INROADS),Data science overtakes computer science?,False,,,0
David Smith,https://ai.northeastern.edu/ai-our-people/david-smith/,https://dl.acm.org/doi/10.1007/978-3-540-31989-4_22,,2005-03-01 00:00:00,ACM,EuroGP'05: Proceedings of the 8th European conference on Genetic Programming,Evolution of a strategy for ship guidance using two implementations of genetic programming,False,,,0
David Smith,https://ai.northeastern.edu/ai-our-people/david-smith/,https://dl.acm.org/doi/10.1016/0004-3702%2888%2990011-2,,1988-06-01 00:00:00,ACM,Artificial Intelligence (ARTI),Reasoning about action I: a possible worlds approach,False,,,0
David Smith,https://ai.northeastern.edu/ai-our-people/david-smith/,https://dl.acm.org/doi/10.5555/42641.42673,,1987-10-01 00:00:00,ACM,Readings in nonmonotonic reasoning,Reasoning about action I: a possible worlds approach,False,,,0
David Smith,https://ai.northeastern.edu/ai-our-people/david-smith/,https://dl.acm.org/doi/10.1016/S0167-4048%2899%2990715-0,,1999-01-01 00:00:00,ACM,Computers and Security (CSEC),Abstract of recent articles and literature: Melissa's mayhem,False,,,0
David Smith,https://ai.northeastern.edu/ai-our-people/david-smith/,https://dl.acm.org/doi/10.1109/LCOMM.2010.091010.101235,,2010-10-01 00:00:00,ACM,IEEE Communications Letters (CL),Effect of timing error on the performance of BPSK modulation over a fading channel,False,,,0
David Smith,https://ai.northeastern.edu/ai-our-people/david-smith/,https://dl.acm.org/doi/10.1016/S1353-4858%2803%2901002-X,,2003-10-01 00:00:00,ACM,Network Security (NETWSEC),News: Microsoft bites back as blame deepens,False,,,0
David Smith,https://ai.northeastern.edu/ai-our-people/david-smith/,https://dl.acm.org/doi/10.1145/3384419.3430570,,2020-11-01 00:00:00,ACM,SenSys '20: Proceedings of the 18th Conference on Embedded Networked Sensor Systems,Uncovering opportunities for energy harvesting technologies: PhD forum abstract,False,,,0
David Smith,https://ai.northeastern.edu/ai-our-people/david-smith/,https://dl.acm.org/doi/10.1016/j.compbiolchem.2007.06.001,,2007-08-01 00:00:00,ACM,Computational Biology and Chemistry (COBC),Molecular gene expression signature patterns for gastric cancer diagnosis,False,,,0
David Smith,https://ai.northeastern.edu/ai-our-people/david-smith/,https://dl.acm.org/doi/10.1109/CCNC.2017.7983165,,2017-01-01 00:00:00,ACM,2017 14th IEEE Annual Consumer Communications & Networking Conference (CCNC),Scalable MAC protocol for D2D communication for future 5G networks,False,,,0
David Smith,https://ai.northeastern.edu/ai-our-people/david-smith/,https://dl.acm.org/doi/10.1007/978-3-030-54455-3_35,,2020-02-01 00:00:00,ACM,Financial Cryptography and Data Security,Marlowe: Implementing and Analysing Financial Contracts on Blockchain,False,,,0
David Smith,https://ai.northeastern.edu/ai-our-people/david-smith/,https://dl.acm.org/doi/10.5555/2936924.2937243,,2016-05-01 00:00:00,ACM,AAMAS '16: Proceedings of the 2016 International Conference on Autonomous Agents & Multiagent Systems,Planning for Symbiotic Action: (Doctoral Consortium),False,,,0
David Smith,https://ai.northeastern.edu/ai-our-people/david-smith/,https://dl.acm.org/doi/10.1109/GLOCOM.2017.8254617,,2017-12-01 00:00:00,ACM,GLOBECOM 2017 - 2017 IEEE Global Communications Conference,Evolutionary Coalitional Game for Correlation-Aware Clustering in Machine-to-Machine Communications,False,,,0
David Smith,https://ai.northeastern.edu/ai-our-people/david-smith/,https://dl.acm.org/doi/10.1007/978-3-319-07221-0_82,,2014-06-01 00:00:00,ACM,ITS 2014: 12th International Conference on Intelligent Tutoring Systems - Volume 8474,Social Network Signatures of Effective Online Communication,False,,,0
David Smith,https://ai.northeastern.edu/ai-our-people/david-smith/,https://dl.acm.org/doi/10.5555/3306127.3331663,,2019-05-01 00:00:00,ACM,AAMAS '19: Proceedings of the 18th International Conference on Autonomous Agents and MultiAgent Systems,Synthesizing Explainable Behavior for Human-AI Collaboration,False,,,0
David Smith,https://ai.northeastern.edu/ai-our-people/david-smith/,https://dl.acm.org/doi/10.1145/1141753.1141793,,2006-06-01 00:00:00,ACM,JCDL '06: Proceedings of the 6th ACM/IEEE-CS joint conference on Digital libraries,Windowing time in digital libraries,False,,,0
David Smith,https://ai.northeastern.edu/ai-our-people/david-smith/,https://dl.acm.org/doi/10.5555/324493.324854,,1986-11-01 00:00:00,ACM,ACM '86: Proceedings of 1986 ACM Fall joint computer conference,"Deriving module interconnectivity from behavioral specifications, and coupling VLSI layout editor for error-free routing",False,,,0
David Smith,https://ai.northeastern.edu/ai-our-people/david-smith/,https://dl.acm.org/doi/10.1109/TEVC.2006.880730,,2007-02-01 00:00:00,ACM,IEEE Transactions on Evolutionary Computation (TEC),The Dandelion Code: A New Coding of Spanning Trees for Genetic Algorithms,False,,,0
David Smith,https://ai.northeastern.edu/ai-our-people/david-smith/,https://dl.acm.org/doi/10.5555/173721.173723,,1993-12-01 00:00:00,ACM,Systems Analysis Modelling Simulation (SAMS),The design of energy and amplitude constrained optimal inputs for system identification,False,,,0
David Smith,https://ai.northeastern.edu/ai-our-people/david-smith/,https://dl.acm.org/doi/10.5555/3151573.3151575,,1999-06-01 00:00:00,ACM,International Journal of Adaptive Control and Signal Processing (ACSP),Automatic steering of ships using neural networks,False,,,0
David Smith,https://ai.northeastern.edu/ai-our-people/david-smith/,https://dl.acm.org/doi/10.5555/58076.58132,,1987-12-01 00:00:00,ACM,Human-computer interaction,Designing the star user interface,False,,,0
David Smith,https://ai.northeastern.edu/ai-our-people/david-smith/,https://dl.acm.org/doi/10.1109/TCAD.1984.1270053,,2006-11-01 00:00:00,ACM,IEEE Transactions on Computer-Aided Design of Integrated Circuits and Systems (TCADICS),The Variable Geometry Automated Universal Array Layout System (VGAUA),False,,,0
David Smith,https://ai.northeastern.edu/ai-our-people/david-smith/,https://dl.acm.org/doi/10.1145/584449.584451,,2002-04-01 00:00:00,ACM,ACM SIGIR Forum (SIGIR),"Annual report for SIGIR, July 2001 - June 2002",False,,,0
David Smith,https://ai.northeastern.edu/ai-our-people/david-smith/,https://dl.acm.org/doi/10.1016/S1570-8705%2816%2930008-7,,2016-03-01 00:00:00,ACM,Ad Hoc Networks (ADHN),Thank you reviewers,False,,,0
David Smith,https://ai.northeastern.edu/ai-our-people/david-smith/,https://dl.acm.org/doi/10.5555/1735293.1735299,,2010-01-01 00:00:00,ACM,International Journal of Knowledge-based and Intelligent Engineering Systems (KIES),Conference report,False,,,0
David Smith,https://ai.northeastern.edu/ai-our-people/david-smith/,https://dl.acm.org/doi/10.5555/1162708.1162892,,2005-12-01 00:00:00,ACM,WSC '05: Proceedings of the 37th conference on Winter simulation,Simulation-based planning for planetary rover experiments,False,,,0
David Smith,https://ai.northeastern.edu/ai-our-people/david-smith/,https://dl.acm.org/doi/10.1162/coli_r_00023,,2010-12-01 00:00:00,ACM,Computational Linguistics (COLI),Book review:,False,,,0
David Smith,https://ai.northeastern.edu/ai-our-people/david-smith/,https://dl.acm.org/doi/10.1145/1506409.1506420,,2009-05-01 00:00:00,ACM,Communications of the ACM (CACM),EducationTeaching computing to everyone,False,,,0
David Smith,https://ai.northeastern.edu/ai-our-people/david-smith/,https://dl.acm.org/doi/10.1145/345124.345156,,2000-08-01 00:00:00,ACM,Communications of the ACM (CACM),Personal end-user tools,False,,,0
David Smith,https://ai.northeastern.edu/ai-our-people/david-smith/,https://dl.acm.org/doi/10.1007/BF01840469,,1990-05-01 00:00:00,ACM,Real-Time Systems (RETS),"Concepts, methods, and languages for building timely intelligent systems",False,,,0
David Smith,https://ai.northeastern.edu/ai-our-people/david-smith/,https://dl.acm.org/doi/10.1162/jocn.2009.21241,,2010-02-01 00:00:00,ACM,Journal of Cognitive Neuroscience (JOCN),Spatial attention evokes similar activation patterns for visual and auditory stimuli,False,,,0
David Smith,https://ai.northeastern.edu/ai-our-people/david-smith/,https://dl.acm.org/doi/10.1109/AERO.2011.5747506,,2011-03-01 00:00:00,ACM,AERO '11: Proceedings of the 2011 IEEE Aerospace Conference,Mars ascent vehicle test requirements and terrestrial validation,False,,,0
David Smith,https://ai.northeastern.edu/ai-our-people/david-smith/,https://dl.acm.org/doi/10.1016/j.cmpb.2023.107353,,2023-03-01 00:00:00,ACM,Computer Methods and Programs in Biomedicine (CBIO),Osteochondral junction leakage and cartilage joint lubrication,False,,,0
David Smith,https://ai.northeastern.edu/ai-our-people/david-smith/,https://dl.acm.org/doi/10.1016/j.envsoft.2016.02.029,,2016-06-01 00:00:00,ACM,Environmental Modelling & Software (ENMS),A Bayesian Belief Network to assess rate of changes in coral reef ecosystems,False,,,0
David Smith,https://ai.northeastern.edu/ai-our-people/david-smith/,https://dl.acm.org/doi/10.1109/PIMRC.2015.7343503,,2015-08-01 00:00:00,ACM,"2015 IEEE 26th Annual International Symposium on Personal, Indoor, and Mobile Radio Communications (PIMRC)",Self-organization amongst multiple co-existing wireless body area networks,False,,,0
David Smith,https://ai.northeastern.edu/ai-our-people/david-smith/,https://dl.acm.org/doi/10.1109/DoD.HPCMP.UGC.2008.10,,2008-07-01 00:00:00,ACM,HPCMP-UGC '08: Proceedings of the 2008 DoD HPCMP Users Group Conference,A New Approach to Streambed Modeling and Simulation Using CFD,False,,,0
David Smith,https://ai.northeastern.edu/ai-our-people/david-smith/,https://dl.acm.org/doi/10.1145/3478431.3499388,,2022-02-01 00:00:00,ACM,SIGCSE 2022: Proceedings of the 53rd ACM Technical Symposium on Computer Science Education - Volume 1,Are We Fair?: Quantifying Score Impacts of Computer Science Exams with Randomized Question Pools,False,,,0
David Smith,https://ai.northeastern.edu/ai-our-people/david-smith/,https://dl.acm.org/doi/10.1016/S0167-4048%2899%2980073-X,,1999-01-01 00:00:00,ACM,Computers and Security (CSEC),Special feature: No suprises in Melissa Land,False,,,0
David Smith,https://ai.northeastern.edu/ai-our-people/david-smith/,https://dl.acm.org/doi/10.1109/C5.2006.32,,2006-01-01 00:00:00,ACM,"C5 '06: Proceedings of the Fourth International Conference on Creating, Connecting and Collaborating through Computing",Scalability of Collaborative Environments,False,,,0
David Smith,https://ai.northeastern.edu/ai-our-people/david-smith/,https://dl.acm.org/doi/10.1007/978-3-030-61467-6_1,,2020-10-01 00:00:00,ACM,"Leveraging Applications of Formal Methods, Verification and Validation: Applications",Reliable Smart Contracts,False,,,0
David Smith,https://ai.northeastern.edu/ai-our-people/david-smith/,https://dl.acm.org/doi/10.1109/TITS.2015.2462824,,2015-12-01 00:00:00,ACM,IEEE Transactions on Intelligent Transportation Systems (TITS),Cost Minimization of Charging Stations With Photovoltaics: An Approach With EV Classification,False,,,0
David Smith,https://ai.northeastern.edu/ai-our-people/david-smith/,https://dl.acm.org/doi/10.1145/378916.378922,,1987-09-01 00:00:00,ACM,ACM SIGDA Newsletter (SIGDA),Minutes: (sigda meetings),False,,,0
David Smith,https://ai.northeastern.edu/ai-our-people/david-smith/,https://dl.acm.org/doi/10.5555/1654650.1654667,,2006-06-01 00:00:00,ACM,StatMT '06: Proceedings of the Workshop on Statistical Machine Translation,NTT system description for the WMT2006 shared task,False,,,0
David Smith,https://ai.northeastern.edu/ai-our-people/david-smith/,https://dl.acm.org/doi/10.1109/ICRA.2019.8794453,,2019-05-01 00:00:00,ACM,2019 International Conference on Robotics and Automation (ICRA),LookUP: Vision-Only Real-Time Precise Underground Localisation for Autonomous Mining Vehicles,False,,,0
David Smith,https://ai.northeastern.edu/ai-our-people/david-smith/,https://dl.acm.org/doi/10.1016/j.future.2019.01.039,,2019-07-01 00:00:00,ACM,Future Generation Computer Systems (FGCS),Enhancing Network Visibility and Security through Tensor Analysis,False,,,0
David Smith,https://ai.northeastern.edu/ai-our-people/david-smith/,https://dl.acm.org/doi/10.1109/IROS.2018.8593750,,2018-10-01 00:00:00,ACM,2018 IEEE/RSJ International Conference on Intelligent Robots and Systems (IROS),Semi-Supervised SLAM: Leveraging Low-Cost Sensors on Underground Autonomous Vehicles for Position Tracking,False,,,0
David Smith,https://ai.northeastern.edu/ai-our-people/david-smith/,https://dl.acm.org/doi/10.1109/IROS45743.2020.9340832,,2020-10-01 00:00:00,ACM,2020 IEEE/RSJ International Conference on Intelligent Robots and Systems (IROS),Designing Environments Conducive to Interpretable Robot Behavior,False,,,0
David Smith,https://ai.northeastern.edu/ai-our-people/david-smith/,https://dl.acm.org/doi/10.5555/2111713.2111718,,2006-09-01 00:00:00,ACM,CompLife'06: Proceedings of the Second international conference on Computational Life Sciences,Parametric spectral analysis of malaria gene expression time series data,False,,,0
David Smith,https://ai.northeastern.edu/ai-our-people/david-smith/,https://dl.acm.org/doi/10.5555/2814579.2814593,,2015-07-01 00:00:00,ACM,TaPP'15: Proceedings of the 7th USENIX Conference on Theory and Practice of Provenance,Cell-based causality for data repairs,False,,,0
David Smith,https://ai.northeastern.edu/ai-our-people/david-smith/,https://dl.acm.org/doi/10.5555/2132960.2132971,,2011-07-01 00:00:00,ACM,WMT '11: Proceedings of the Sixth Workshop on Statistical Machine Translation,Evaluation without references: IBM1 scores as evaluation metrics,False,,,0
David Smith,https://ai.northeastern.edu/ai-our-people/david-smith/,https://dl.acm.org/doi/10.1145/142181.142183,,1992-12-01 00:00:00,ACM,ACM SIGPLAN Notices (SIGPLAN),Report on the CHI'91 Workshop on Languages for Developing User Interfaces,False,,,0
David Smith,https://ai.northeastern.edu/ai-our-people/david-smith/,https://dl.acm.org/doi/10.1145/792550.792568,,2002-09-01 00:00:00,ACM,ACM SIGIR Forum (SIGIR),Workshop report: Digital gazetteers: integration into distributed digital library services,False,,,0
David Smith,https://ai.northeastern.edu/ai-our-people/david-smith/,https://dl.acm.org/doi/10.5555/2074284.2074333,,1996-08-01 00:00:00,ACM,UAI'96: Proceedings of the Twelfth international conference on Uncertainty in artificial intelligence,Geometric implications of the naive Bayes assumption,False,,,0
David Smith,https://ai.northeastern.edu/ai-our-people/david-smith/,https://dl.acm.org/doi/10.1007/s11664-997-0056-1,,1997-01-01 00:00:00,ACM,Journal of Electronic Materials (JELM),X-ray diffraction and high resolution transmission electron microscopy of 3C-SiC/AlN/6H-SiC(0001),False,,,0
David Smith,https://ai.northeastern.edu/ai-our-people/david-smith/,https://dl.acm.org/doi/10.1613/jair.1.12813,,2022-01-01 00:00:00,ACM,Journal of Artificial Intelligence Research (JAIR),Contrastive Explanations of Plans through Model Restrictions,False,,,0
David Smith,https://ai.northeastern.edu/ai-our-people/david-smith/,https://dl.acm.org/doi/10.5555/978-3-030-61467-6_fm,,2020-10-01 00:00:00,ACM,"Leveraging Applications of Formal Methods, Verification and Validation: Applications",Front Matter,False,,,0
David Smith,https://ai.northeastern.edu/ai-our-people/david-smith/,https://dl.acm.org/doi/10.1145/642611.642682,,2003-04-01 00:00:00,ACM,CHI '03: Proceedings of the SIGCHI Conference on Human Factors in Computing Systems,How do people manage their digital photographs?,False,,,0
David Smith,https://ai.northeastern.edu/ai-our-people/david-smith/,https://dl.acm.org/doi/10.1145/3532512.3535224,,2022-12-01 00:00:00,ACM,"Programming '22: Companion Proceedings of the 6th International Conference on the Art, Science, and Engineering of Programming",An Experiment in Live Collaborative Programming on the Croquet Shared Experience Platform,False,,,0
David Smith,https://ai.northeastern.edu/ai-our-people/david-smith/,https://dl.acm.org/doi/10.1504/IJBRA.2008.019579,,2008-07-01 00:00:00,ACM,International Journal of Bioinformatics Research and Applications (IJBRA),Spectral analysis of microarray gene expression time series data of Plasmodium falciparum,False,,,0
David Smith,https://ai.northeastern.edu/ai-our-people/david-smith/,https://dl.acm.org/doi/10.1155/2017/7835749,,2017-01-01 00:00:00,ACM,Journal of Biomedical Imaging (IJBI),Quantitative Evaluation of Temporal Regularizers in Compressed Sensing Dynamic Contrast Enhanced MRI of the Breast,False,,,0
David Smith,https://ai.northeastern.edu/ai-our-people/david-smith/,https://dl.acm.org/doi/10.5555/1654449.1654477,,2005-06-01 00:00:00,ACM,ParaText '05: Proceedings of the ACL Workshop on Building and Using Parallel Texts,PORTAGE: a phrase-based machine translation system,False,,,0
David Smith,https://ai.northeastern.edu/ai-our-people/david-smith/,https://dl.acm.org/doi/10.5555/3090557.3090570,,2002-04-01 00:00:00,ACM,PTD'02: Proceedings of the 2002 International Conference on Planning for Temporal Domains,Planning under continuous time and resource uncertainty: a challenge for AI,False,,,0
David Smith,https://ai.northeastern.edu/ai-our-people/david-smith/,https://dl.acm.org/doi/10.5555/1817770.1817995,,2009-06-01 00:00:00,ACM,ICC'09: Proceedings of the 2009 IEEE international conference on Communications,Matched rotation precoding: a new paradigm in space-frequency coding,False,,,0
David Smith,https://ai.northeastern.edu/ai-our-people/david-smith/,https://dl.acm.org/doi/10.1007/s10796-018-9871-6,,2018-08-01 00:00:00,ACM,Information Systems Frontiers (KLU-ISFI),Disaster Management and Information Systems: Insights to Emerging Challenges,False,,,0
David Smith,https://ai.northeastern.edu/ai-our-people/david-smith/,https://dl.acm.org/doi/10.5555/1697236.1697241,,2009-10-01 00:00:00,ACM,IWPT '09: Proceedings of the 11th International Conference on Parsing Technologies,Automatic adaptation of annotation standards for dependency parsing: using projected treebank as source corpus,False,,,0
David Smith,https://ai.northeastern.edu/ai-our-people/david-smith/,https://dl.acm.org/doi/10.1145/155804.155811,,1993-04-01 00:00:00,ACM,ACM SIGCHI Bulletin (SIGCHI),Report on the CHI'91 workshop on languages for developing user interfaces,False,,,0
David Smith,https://ai.northeastern.edu/ai-our-people/david-smith/,https://dl.acm.org/doi/10.5555/850956.854072,,1995-04-01 00:00:00,ACM,INFOCOM '95: Proceedings of the Fourteenth Annual Joint Conference of the IEEE Computer and Communication Societies (Vol. 1)-Volume - Volume 1,ATMTraP: an asynchronous transfer mode traffic and performance measurement tool,False,,,0
David Smith,https://ai.northeastern.edu/ai-our-people/david-smith/,https://dl.acm.org/doi/10.1145/1281881.1281900,,2007-07-01 00:00:00,ACM,Queue (QUEUE),Some Swans are Black: …and other catastrophes,False,,,0
David Smith,https://ai.northeastern.edu/ai-our-people/david-smith/,https://dl.acm.org/doi/10.5555/1699571.1699627,,2009-08-01 00:00:00,ACM,EMNLP '09: Proceedings of the 2009 Conference on Empirical Methods in Natural Language Processing: Volume 2 - Volume 2,Polylingual topic models,False,,,0
David Smith,https://ai.northeastern.edu/ai-our-people/david-smith/,https://dl.acm.org/doi/10.1145/108844.108966,,1991-03-01 00:00:00,ACM,CHI '91: Proceedings of the SIGCHI Conference on Human Factors in Computing Systems,Demonstrational interfaces: Coming soon?,False,,,0
David Smith,https://ai.northeastern.edu/ai-our-people/david-smith/,https://dl.acm.org/doi/10.1145/2160165.2160166,,2012-04-01 00:00:00,ACM,Journal on Computing and Cultural Heritage  (JOCCH),"Introduction to the special issue on corpus and computational linguistics, philology, and the linguistic heritage of humanity",False,,,0
David Smith,https://ai.northeastern.edu/ai-our-people/david-smith/,https://dl.acm.org/doi/10.1145/3569085,,2023-02-01 00:00:00,ACM,ACM Computing Surveys (CSUR),Private Graph Data Release: A Survey,False,,,0
David Smith,https://ai.northeastern.edu/ai-our-people/david-smith/,https://dl.acm.org/doi/10.5555/1325851.1325968,,2007-09-01 00:00:00,ACM,VLDB '07: Proceedings of the 33rd international conference on Very large data bases,Declarative information extraction using datalog with embedded extraction predicates,False,,,0
David Smith,https://ai.northeastern.edu/ai-our-people/david-smith/,https://dl.acm.org/doi/10.14778/3583140.3583163,,2023-02-01 00:00:00,ACM,Proceedings of the VLDB Endowment (PVLDB),Sparkly: A Simple yet Surprisingly Strong TF/IDF Blocker for Entity Matching,False,,,0
David Smith,https://ai.northeastern.edu/ai-our-people/david-smith/,https://dl.acm.org/doi/10.1145/1044588.1044666,,2004-06-01 00:00:00,ACM,VRCAI '04: Proceedings of the 2004 ACM SIGGRAPH international conference on Virtual Reality continuum and its applications in industry,An investigation into different visual/tactual feedback modes for a virtual object manipulation task,False,,,0
David Smith,https://ai.northeastern.edu/ai-our-people/david-smith/,https://dl.acm.org/doi/10.1145/1979742.1979859,,2011-05-01 00:00:00,ACM,CHI EA '11: CHI '11 Extended Abstracts on Human Factors in Computing Systems,AnalyzeThis: unobtrusive mental health monitoring by voice,False,,,0
David Smith,https://ai.northeastern.edu/ai-our-people/david-smith/,https://dl.acm.org/doi/10.1145/378916.378924,,1987-09-01 00:00:00,ACM,ACM SIGDA Newsletter (SIGDA),ACM lectureship program,False,,,0
David Smith,https://ai.northeastern.edu/ai-our-people/david-smith/,https://dl.acm.org/doi/10.1145/1230040.1230044,,2006-10-01 00:00:00,ACM,NetGames '06: Proceedings of 5th ACM SIGCOMM workshop on Network and system support for games,Plug-replaceable consistency maintenance for multiplayer games,False,,,0
David Smith,https://ai.northeastern.edu/ai-our-people/david-smith/,https://dl.acm.org/doi/10.1145/1216016.1216026,,2007-02-01 00:00:00,ACM,Communications of the ACM (CACM),The impact of offshore outsourcing on IT workers in developed countries,False,,,0
David Smith,https://ai.northeastern.edu/ai-our-people/david-smith/,https://dl.acm.org/doi/10.1080/00207720701777959,,2008-04-01 00:00:00,ACM,International Journal of Systems Science (IJSS),Optimisation of the weighting functions of an H ∞ controller using genetic algorithms and structured genetic algorithms,False,,,0
David Smith,https://ai.northeastern.edu/ai-our-people/david-smith/,https://dl.acm.org/doi/10.5555/1654449.1654463,,2005-06-01 00:00:00,ACM,ParaText '05: Proceedings of the ACL Workshop on Building and Using Parallel Texts,Models for Inuktitut-English word alignment,False,,,0
David Smith,https://ai.northeastern.edu/ai-our-people/david-smith/,https://dl.acm.org/doi/10.1145/1920778.1920816,,2010-05-01 00:00:00,ACM,Futureplay '10: Proceedings of the International Academic Conference on the Future of Game Design and Technology,A framework for the online evaluation of serious games,False,,,0
David Smith,https://ai.northeastern.edu/ai-our-people/david-smith/,https://dl.acm.org/doi/10.1145/3405476,,2020-07-01 00:00:00,ACM,Communications of the ACM (CACM),Magellan: toward building ecosystems of entity matching solutions,False,,,0
David Smith,https://ai.northeastern.edu/ai-our-people/david-smith/,https://dl.acm.org/doi/10.1162/jocn.2010.21575,,2011-09-01 00:00:00,ACM,Journal of Cognitive Neuroscience (JOCN),Rapid modulation of sensory processing induced by stimulus conflict,False,,,0
David Smith,https://ai.northeastern.edu/ai-our-people/david-smith/,https://dl.acm.org/doi/10.5555/2073876.2073886,,2002-08-01 00:00:00,ACM,UAI'02: Proceedings of the Eighteenth conference on Uncertainty in artificial intelligence,Planning under continuous time and resource uncertainty: a challenge for AI,False,,,0
David Smith,https://ai.northeastern.edu/ai-our-people/david-smith/,https://dl.acm.org/doi/10.5555/2002736.2002777,,2011-06-01 00:00:00,ACM,HLT '11: Proceedings of the 49th Annual Meeting of the Association for Computational Linguistics: Human Language Technologies: short papers - Volume 2,Transition-based dependency parsing with rich non-local features,False,,,0
David Smith,https://ai.northeastern.edu/ai-our-people/david-smith/,https://dl.acm.org/doi/10.1145/329155.329159,,1999-07-01 00:00:00,ACM,ACM SIGSOFT Software Engineering Notes (SIGSOFT),Risks to the public in computers and related systems,False,,,0
David Smith,https://ai.northeastern.edu/ai-our-people/david-smith/,https://dl.acm.org/doi/10.1109/IROS.2015.7354125,,2015-09-01 00:00:00,ACM,2015 IEEE/RSJ International Conference on Intelligent Robots and Systems (IROS),Planning for serendipity,False,,,0
David Smith,https://ai.northeastern.edu/ai-our-people/david-smith/,https://dl.acm.org/doi/10.1145/266838.276979,,1997-11-01 00:00:00,ACM,GROUP '97: Proceedings of the 1997 ACM International Conference on Supporting Group Work,The role for technology in knowledge management (panel),False,,,0
